작성자,제품명,리뷰작성일,별점,한달 사용기,리뷰 내용,도움 수
bell******,ETAG: 알바 블루,20250323,4,,"제 첫 전담 기기가 차이코스 였는데, 사용한지 몇 개월만에 히팅 블레이드가 부러지는 불상사(?)가 생기는 그다지 좋은 기억은 없었습니다. 그 후에 아이코스 일루마를 구입해 사용하다 일루마가 생각보다 부피가 크고 무거워 휴대성이 좋지 않아 이번 기회에 휴대성 좋은 전담을 찾다 본 제품을 구입하게 됐습니다. 디스플레이가 있어 직관성이 좋고, 3가지 모드로 셋팅(저는 캡슐 테리아를 태우기 때문에 멘솔 모드만 씁니다만...)할 수 있어 취향에 맞춰 즐길 수 있다는 점이 장점일 듯 싶습니다. 반면, 개인적으로 다소 아쉬운 점이라면, 디스플레이 때문인지 몰라도 한 쪽이 각이 진 디자인이라 손에 움켜지는 방식으로 즐기는 제게는 조금 불편했습니다. 되도록 전 제품의 안 좋은 기억을 잊고, 이 제품으로 오랫동안 전담을 즐겼으면 좋겠습니다.",0
show******,ETAG: 알바 블루,20250423,5,,히팅시간 정말 짧아서 좋아요 특히 중간에 일시정지 시간이 길어서 좋아요 추천해요,0
nam4***,ETAG: 오닉스 블랙,20250507,5,,너무너무조아효 담에 또구매,0
jn****,ETAG: 차콜 그레이,20250504,4,,기존 제품 쓰고 있는데 딱히 달라진점은 모르겠네요,0
d2pr*****,ETAG: 차콜 그레이,20250425,5,,연무량 쪼금 아쉽다고하시는데 아빠담배냄새 넘 심해서 선물했는데 가족들이 모두 만족해요..ㅋㅋ,0
just**********,ETAG: 차콜 그레이,20250413,5,,"아이코스를 사서 사용하다가 열받아서 현존 최고 전담 조사하고 샀습니다. 온도 및 시간, 그리고 연속사용이 가능한게 좋네요. 조금 더 사용해보고 선물용으로 하나 더 사야겠습니다.",0
kimj*****,ETAG: 쉬폰 화이트,20250423,5,,릴 쓰다가 갈아탔어요 카트리지 안쓰는거 편해요 온도 타격감조정도 좋아요,0
bbed***,ETAG: 알바 블루,20250411,4,,아이코스 쓰다가 타격감 기대하고 삿는대 딱히 차이를 못느끼겟네요 모드바꿔가며 써봐야 자세히 알겟지만 4개 베이핑해봐선 차이를 모르겟네요 일단 나쁘진않습니다,0
path***,ETAG: 쉬폰 화이트,20250509,5,,일루마보다 더 좋은 듯 ㅋㅋㅋ,0
lj****,ETAG: 알바 블루,20250502,5,,연초피다 전자담배로 처음 바꿨는데 깔끔하니 좋네요,0
ki****,ETAG: 차콜 그레이,20250418,5,,타격감 만족하면서 쓰고 있습니다.~^^ 솔직히 연초만큼은 아니지만 다른 전담에 비해 만족합니다.,0
hyeo****,ETAG: 알바 블루,20250502,4,,좋은거 같지만 확실히 연초를 따라갈 수는 없네요,0
ksk3*****,ETAG: 차콜 그레이,20250411,5,,슬림하고 외관이 좋아보여요 지금 충전중인데 테리아 구매해서 사용해 볼 겁니다 근데 워낙 주위 반응이 좋아서 성능 내용은 잘 알고 있습니다 고장 잘 안나면 금상첨화 겠지요,0
pjh5***,ETAG: 오닉스 블랙,20250503,5,,아직 적응임 안돼는데 한번 사용해 볼게요,0
hks3***,ETAG: 알바 블루,20250507,5,,연무량도 좋고 좋네요,0
ke****,ETAG: 알바 블루,20250327,4,,일단 배송은 다음날 바로와서 좋았습니다. 궐련형은 처음 사용하는거라 다른 제품과 비교는 힘들지만 예전 액상형 전자담배와 비교한다면 타격감이나 향 이런건 조금 떨어지는 부분은 있으나 연초 냄새가 몸에 안나는부분은 너무 좋네요. 현재로써는 만족스럽고 다행이도 연초 생각은 안납니다. 연무량 타격감 이런것들만 조금 포기하면서 사용한다면 괜찮을것 같아요,0
tost****,ETAG: 차콜 그레이,20250327,5,,연초를 피다 담배냄새 때문에 궐련형을 구매했는데 주변에도 추천해 줄만큼 생각보다 목넘김이 좋아서 만족합니다. 그리고 기기 사이즈도 휴대하기 좋고 배터리도 오래간다고 해서 충전도 자주 안해도 되는 점이 좋네요! 게다가 컬러가 네 가지나 있어서 구매시 원하는 색상을 고를 수 있어서 좋았습니다! 조금 더 사용해봐야 알겠지만 한 달 사용해보고 후기 또 남기겠습니다!,0
am****,ETAG: 쉬폰 화이트,20250426,5,,연초와 가장 가까운 전자담배 입니다 아이코스 보다 타겨캄은 좋아요,0
dark****,ETAG: 알바 블루,20250502,5,,만족합니다 잘쓰고있습니다,0
