작성자,제품명,리뷰작성일,별점,한달 사용기,리뷰 내용,도움 수
ps****,ETAG: 차콜 그레이,20250420,5,,여러제품을 직접 시연해본건 아니지만 지인의 릴하이브리드 잠시 사용해보고 아쉬움이 있구나 싶어 다시 찾던중 본품을 신중히 고민하고 구입했네요. 물품도착 안했으나 테리아 센티아 두제품을 미리구입하여 기다렸죠. 제품받고 시연결과 어. 타격감이 제겐 맞더군요. 혹시나 싶어 얼마간 기간을 두고 약간의 하자가 있었지만 교환.환불 포기하고 사용하려던차 판매자님의 신속한 교환처리 해주셨네요. 개인차는 있겠지만 타격감 제겐 확실히 세게 느껴지거든요.(연초에 가깝다는거죠. 참고로 멘솔류 좋아하기에) 지인이 사용하는 릴종류를 고민했으나 본품이 전 맞는것 같아요. 액상별도 구입 번거롭고 피운건지 느낌도 없고 근데 이제품은 만족합니다. 테리아 센티아 두제품 인덕션방식으로 사용할수 있기에. 암튼 판매자분 번거롭게 해드릴생각은 없었으나 직업병때문에 어쩔수 없더군요. 회사업무상 하자원인분석등도 하는일이다보니 짚고 넘어가질 못해서요. 잘사용할께요. 수고하세요~ (아! 청소는 혹시 연초류나 멘솔류 한가지가 아닌 겸용으로 하실경우 생각날때 한번 내부 면봉으로 살짝 닦아주심 맛이 좋을거예요. 그냥 개인적으로 갈아탈때 닦으니 괜찮더라구요.),1
eo****,ETAG: 차콜 그레이,20250423,5,,"배송 안전하고 빠릅니다. 우체국 소포로 다음날에 오네요. 한동안 찐담배 안폈는데.. 요즘은 청소가 필요없는 방식이라니 신세계네요. 거기다 배터리 용량도 커서 자주 충전 안해도 되고 진짜 와 굿입니다. 음... 온도를 높여서 해보긴 했는데, 역시 연초 만큼의 타격감과 연무량은 아닌것 같네요. 그리고 배터리 충전량이 많을때 좀 더 강한 느낌이구요. 테리아 엠버와 블루로 테스트해 봤는데, 예전 아이코스 보다는 나은 것 같네요. 다음에는 스틱을 좀 더 강한걸로 찾아봐야겠어요.",0
elma******,ETAG: 알바 블루,20250417,5,,연초에 만 피다가 전자 담배로 넘어 왔는데 아무래도 연초보다는 못하겠죠 테리아 엠버랑 센티아 골드를 사용해봤는데 테리아가 연무량이나 맛에선 센티아 보다는 나은거 같습니다 센티아는 연무량이 좀 약하고 좀더 순한 느낌이랄까 연초랑 비교할까요! 배송 아주 좋습니다 배송과정 메세지가 중간중간오니까 아주 좋았습니다 쿠팡 못지않아요 제품박스 퀄리티 아주 좋습니다 자석으로 열고 닫기 아 버리기 아까워 보관중입니다 상품은 알바 블루인데 이것도 좋습니다 재질감이나 크기 손에 잡기 크기 딱 좋습니다 설정이 첨엔 햇갈렸는데 금방 적응됩니다 아직 사람마다 달라서 온도나 시간 조절을 이리저리 시험중이고 삽입구도 위로 가 아니라 옆으로 밀면 딱하고 열고 닫고 할수있어 고급스럽습니다 모드 조절이 있어서 좋습니다 프리모드에서만 온도나 시간 나머지 부분설정 가능 하고 배터리는 아주 오래 갑니다 고속도 되지만 저속이 배터리 수명에 도움이 된다해서 전 저속으로 해도 충전 시간 빠릅니다 물론 완전 방전은 배터리에 좋지 않기때문에 한칸 남았을때 설명서에 10w입력으로 있어서 그이하로 충전합니다 마지막에30초 남았을때나 가열 시작 끝났을때 진동신호도 편리성중에 하납니다 화면 볼필요도 없습니다 퀄리티 아주 좋습니다 딱히 깔께 없습니다 딱하나 있다면 전용 어댑터가 포함되지 않았다는거 요즘 저속 어댑터가 잘 없어서 물론 쿠팡엔 몇게 있지만요 그것빼곤 저 입장엔 배송부터 제품까지 아주 만족스럽습니다 끝으로 1년 반이나 금연하다 실패한게 아쉽지만 딱한번만 해볼까 하다가 다시금 실패했네요 물론 연초만 하겠습니까 만은 AS만 좋다면 이 제품 추천 드립니다,0
alsw******,ETAG: 차콜 그레이,20250514,4,,전담은 처음이라 몇일을 고민하다가 좋은후기보고 구매결정했어요. 일단은 조작법은 어렵지않아 좋은데 다른분들 말처럼 연무량이 많지는 않은것같아요. .조작을 잘 못 한건지..뭐가 잘못됐는지 모르겠네요ㅠ 다만족하는데 연무량이 아쉽네요,0
seph****,ETAG: 알바 블루,20250406,5,,"이 리뷰를 보시는 분들께 조금이라도 도움이 되었으면 해서 글 남깁니다. 솔직히 제가 뽑기 운이 없었던 건지, 처음 구매한 뒤 두 번 연속으로 문제가 생겼습니다. 1. 첫 제품: 전원 버튼이 간헐적으로 반응하지 않았고, 프리모드(340도)로 사용했을 때 연무량이 생각보다 적었어요. 또 담배를 꽂아둔 상태에서 전원 버튼을 눌러도 가열되지 않는 경우가 있었습니다. 2. 교환 제품: 300도 3분30초 셋팅 후 사용했는데도 배터리가 1개비 피울 때마다 1칸씩 줄었고, 20개비 정도 피웠을 때 이미 절반 이상 소모됐습니다. 그리고 진동이 울릴 때 담배 꽂는 부분에서 마찰음 같은 소리가 나더라고요. 현재 사용 중인 3번째 교환 제품은 문제 없이 잘 작동하고 있어서 다행이라고 생각합니다. 사실 처음에는 두 번이나 문제가 생겨서 스트레스를 많이 받았지만, 고객센터와 검수팀의 응대가 빨라서 그런 부분은 괜찮았어요. 이태그 자체는 디자인도 깔끔하고 작아서 휴대하기 편하고, 배터리 용량도 넉넉한 편이라 만족하며 사용 중입니다. 이 리뷰가 구매 고민 중이신 분들께 조금이라도 참고가 되길 바랍니다!",0
pete********,ETAG: 오닉스 블랙,20250504,4,,"이태그 한달 간 쓰면서 너무 만족스럽고, 센티아 스틱과도 호환되면서 잘 쓰고 있습니다. 가끔 배터리가 60~70% 이하 정도로 완충기준 하루 반나절 지나면 스틱 맛이 미묘하게 달라지네요. 약간 끈적하게 빨리는 감이 있어서 되도록 완충해서 피는 편이에요. 그래도 온도 조정, 멘솔/타바코 모드 등 다양하게 맛볼 수 있어서 좋은 것 같습니다. 감사합니다~",0
east****,ETAG: 알바 블루,20250510,5,,담배보다는 만족감은 떨어지는데 기기 성능은 설명대로 좋네요 연무량은 적은 편입니다 감안하고 구매하시고 사용도 간편하고 액정 꺼져있을때 방향키만 한번 눌러서 켜주고 스틱 넣으면 편하게 사용 가능합니다,0
sky0*****,ETAG: 오닉스 블랙,20250506,5,,뜸 냄새가 적게나서 너무 좋네요! 냄새 때문에 맨날 와이프한테 눈치 받았는데 확실히 냄새가 덜하니까 싸울일이 없어져서 너무 좋아요! 최고입니다ㅎ,0
jju_***,ETAG: 쉬폰 화이트,20250514,5,,직관적인 액정표시와 온도와 시간 조절이 가능해서 좋아요 저는 하얀색을 구매했는데 손때가 좀 타네요; 어두운 색상으로 살 걸 조금 후회는 됩니다,0
ihan***,ETAG: 알바 블루,20250511,5,,너무 좋아요 온도도 조절 가능하고 실용적이에요,0
aceh*****,ETAG: 알바 블루,20250513,5,,"잘 도착했네요 블루를 주문했는데 화이트가 도착 ㅡㅡ; 그래도 만족입니다. 매번 청소할 필요도 앖어 깔끔하고, 천천히 피니 연무량도 만족스럽습니다. 굿",0
sexy******,ETAG: 차콜 그레이,20250515,5,,"디자인이나 품질이나 어느하나 부족한게 없네요 :) 아버지가 제꺼 보시더니, 하나 더 주문해달라하셔서 막바로 재구매 합니다 :)",0
hv****,ETAG: 쉬폰 화이트,20250508,5,,배송은 신속 제품은 깔끔 좋네요 아직 사용 많이 안해봤지만 느낌이 아주 좋습니다,0
jjjm******,ETAG: 알바 블루,20250514,5,,배송 빨라요~ 원래 쓰던 것이 고장나서 새로 구입했는데 고장 안나고 잘 사용하면 좋겠네요,0
kt****,ETAG: 알바 블루,20250511,5,,배송도빠르고 작동도 잘되서 좋습니다! 이틀사용했는데 담배냄새안나서 너무좋네요ㅠㅠ,0
rhfu*******,ETAG: 알바 블루,20250511,4,,배송도 하루만에 오고 좋아요 블루 색상 삿는데 화이트가왔네요 귀차나서 그냥 씁니다,0
psoo*****,ETAG: 알바 블루,20250503,5,,너무너무 잘 사용하고 있어요!! 기계치인지라 온도 시간 설정 할수있을까 싶었는데 쉬워서 놀랐어요 :) 재구매의사 있습니닷!!,0
sonh****,ETAG: 알바 블루,20250510,5,,현재도 매우 만족하며 잘 쓰고있어요 아직 불편한점은 딱히 없는거 같아요. 앞으로도 잘 써볼께요,1
stzz*****,ETAG: 오닉스 블랙,20250508,5,,제품이 좋아요 배송도 좋지만 디자인도 마음에 들고 모드도 제마음대로 가능해서 좋네요 타격감은 아직 잘 모르겠어여 ㅋㅋ,0
dkzn*******,ETAG: 차콜 그레이,20250510,5,,"제꺼 구매하고, 남친이가 원래 전담피웠는데 제꺼 한번 사용해보더니 괜찮다고 해서 또 구매 했어요~ 전에꺼보다 훨 좋다고 하네요",0
as82*****,ETAG: 차콜 그레이,20250511,4,,타격감은 괜찮은거 같은데 연기가 좀 약한거 같아요..약간 금연초 느낌..담배 냄새는 안나서 좋은거 같아요,0
hmh4***,ETAG: 쉬폰 화이트,20250512,5,,일단 사용하기 간단해서 너무 좋아요 조잡하고 청소해야하고 그래야하는 부분없는점 너무 좋습니당 ㅋㅋ,0
fom7***,ETAG: 차콜 그레이,20250513,4,,냄새 안 나는 건 좋은데 연무량이 너무 적습니다. 기대하고 사시면 안 될 것 같아요.,0
skyz****,ETAG: 쉬폰 화이트,20250429,5,,색깔도 깔끔하고 포장도 좋아요! 선물용으로 보내줘서 받으신분이 아직 시연 전이지만 벌써부터 두근거립니다.,1
rhwr****,ETAG: 오닉스 블랙,20250511,5,,관리가 너무 편하네요 타 제품들보다 만족도 높아서 주변 고민중인 사람들도 추천드리고있어요,0
sseo******,ETAG: 오닉스 블랙,20250514,5,,좋아요 맘에들어요 잘쓸께요,0
hanc*******,ETAG: 쉬폰 화이트,20250511,5,,아직 잘 모르겠어요. 디스플러스만 20년을 피우다가 바꾸려니 약한듯 하여 한번에 여러 까치 피우네요.,0
srew****,ETAG: 알바 블루,20250417,5,,주문하고 그 다음날 받아서 받자마자 사용 같이 동봉되어 들어 있는 설명서는 한번 읽어 보시고 본인에 맞는 흡연 스타일 찾으실려면 동영상 참조 하시길 바라며 타격감 연무량은 연초 및 릴 못 따라가네요 베터는 오래가는거 같구요 일루마랑 별만 차이 업는거 같아요(세번정도 사용하고 박스 그대로 모셔 놓음) 시간 조절 온도 조절 말고는 딱히... 만약 릴이 업글해서 베터리 용량 늘리고 카트리지 소모량을 개선한다는 가정하에 전 릴로 다시 갑니다. 녹색창에 있는 내용들에 현혹 되지 마시고(내용들이 읽어보시면 다 거진 똑같아요 복붙 한거 같네요 아님 나만 당할 수 없지 아님 나만 죽을수 없지가 생각 나게 끔)많이 많이 생각 하시고 주위에 릴 일루마 일루코스 차이코스 차이코스 이태그 들고 계신 분들 계시다면 양해 구하고 한번 해 보셔서 본인에 맞는 제품 찾으시길..( 전 그래도 이건 혹시나 해서 구매 했는데 이번에도 박스 고대로 모셔 놓지 않았으면 하네요) 괜히 돈 낭비 하시지 않으셨으면 합니다. 7~8만원 돈이 적은돈이 아니니... 지극히 개인적인 생각 입니다. 절대 악의가 있는거. 아닙니다. 저희 주관적인 생각 및 느낀점 입니다.,1
prom***,ETAG: 차콜 그레이,20250514,5,,배송 빠르네요 기대해봅니다 생각보다 작아 휴대도 좋을듯,0
alex***,ETAG: 알바 블루,20250502,5,,잘사용하고 있어용~^^ 궐련형 담배는 온도만 잘 맞춰주면 맛도 풍부하고 사용시간도 길어서 좋아요~^^ 특히 담배 냄새가 안나서 너무 만족 스러워요~^^,0
shin*********,ETAG: 오닉스 블랙,20250512,5,,남편이 연초바꾸고 싶다고 구매했어요 연초보단 별로라지만 냄새 덜나서 좋네요,0
khs2***,ETAG: 차콜 그레이,20250511,5,,다 좋대요. 전원 버튼 누를 땐 꽉 눌러야 돼요. 이것 말곤 만족합니다.,0
rnfl*******,ETAG: 차콜 그레이,20250429,5,,오늘 받아서 7개피 펴보앗는데요 기존에 쓰던 타사제품에 비해선 연무량이 적습니다. 연무량 제외하곤 디자인이나 타격감 은 좋네요. 배터리 효율은 더 써보면서 지켜봐야할거같습니다.,1
noon***,ETAG: 알바 블루,20250513,5,O,기존 정품보다 온도조절이 가능하여 자기에 맞게 조절가능한게 강점임 배터리용량도 충분하여 이틀은 끄떡없습니다,0
po****,ETAG: 오닉스 블랙,20250512,5,,지금까지 써본 제품중 만족도가 가장 높습니다. 맛이 깔끔해요,0
sn****,ETAG: 오닉스 블랙,20250511,5,,항상 잘 사용하고 있어요. 너무 만족합니다.,0
alex***,ETAG: 차콜 그레이,20250502,5,,만족스러운 궐련형 담배입니다. 담배맛도 풍부하게 이끌어주고 특히 사용시간이 길어서 좋은거 같아요~^^ 냄새도 안나고 정말 굿이예용~~^^,0
iamm****,ETAG: 차콜 그레이,20250511,5,,하루만에 총알배송 받았습니다. 선물이라 아직 개봉은 못했지만 기존에 쓰던거라니 아마 만족할겁니다. ^^,0
odys****,ETAG: 알바 블루,20250503,4,,담배냄새 싫다는 와이프 성화에 함 바꿔보려 구입함. 내게 잘 맞았으면 하는 바램입니다.,0
main***,ETAG: 알바 블루,20250514,5,,매우 만족합니다. 아주 좋아요 ㅎㅎㅎ,0
dkzn*******,ETAG: 차콜 그레이,20250510,5,,"전담으로 바꿔보려고 샀어요 온도조절 기능도 있고,한번 충전하면 오래가서 좋네요",0
good***,ETAG: 오닉스 블랙,20250428,5,,삼성 배터리라고 하여 믿고 구매했습니다. 시간과 온도 조절할 수 있어 좋았습니다. 연무량과 타격감은 다른 제품과 비해 살짝 괜찮은 거 같습니다.,0
ha****,ETAG: 오닉스 블랙,20250506,5,,배송 잘 받았어요. 깔끔하게 포장되어있네요. 구성도 찰지구요. 한달 써보고 후기 남길께요,0
isew***,ETAG: 오닉스 블랙,20250512,5,,잘쓰고 있어요. 편하고 냄새적어서 오히려 더 피우는게 단점,0
ny****,ETAG: 차콜 그레이,20250512,5,,465개피 피운결과 기계 고장없이 잘 사용중이면 좋은 상품이라고봅니다.만족합니다,0
dudg******,ETAG: 오닉스 블랙,20250418,5,O,기계를 분실하거나 파손된다면 정말 재구매 100% 인 상품입니다. 한달지났는데 아직 연초 하나도 안피웠고 잘사용중입니다. 저는 연무량이 연초급이라 생각하는데 연무량이 작다는 리뷰들도있던데 사용방법에따라 차이가 좀 있나봅니다. 대만족하며 사용중이라 별5개도 부족합니다! 굿굿!,0
bb****,ETAG: 오닉스 블랙,20250415,4,,남편이 담배 끊기로 했는데 너무 못 끊어서 사줬구요 스틱은 어떤 걸 사야하는지 좀 같이 안내해주시면 더 좋을 거 같아요 ㅎㅎ 남편이mllx? 샀다가 기기불량인줄 알았어요 ~~ P..프머시기로 사야하고 맛도 많아서 서치해서 샀습니다 남편이 너무 잘 써줘서 참 뽕뽑은 거 같다가도 ..... 이게 좋은 건지 뭔지 뭐라 말하기 참 애매 합니다 왜이렇게 잘 만드셨나요.. ㅜㅜ,0
tnvj****,ETAG: 알바 블루,20250416,5,,전자담배 결정. 일주일동안 검색에 검색하고 픽한 이태그 첨에는 걱정이 많았는데 생각보다 이질감은 적은것 같고 연초와 다르게 찜맛이 조금 나지만 스틱을 잘 고르면 어느 정도는 커버 될거 같아요.. 연무량은 다른 기기 빌려서 피워 보았는데 타 기계보다는 많음.... 세가지 모드 다 피워보았지만 갠적으로는 340도 5분정도 하면 만족할것 같네요..,1
ck28*****,ETAG: 알바 블루,20250418,5,,신랑의 연초흡연으로 마찰이 많아 권하게 됐는데요 사용한지 5일째인데 나름괜찮네요 일딴 연초냄새가 없구요 약간에 옥수수?누룽지?ㅎㅎ 냄새가있네요 연초랑은 차이가 있지만 나름 견딜만 하다네요 사용법도 편하고 디자인도마음에든데요 남편에 금연에 도움이 되었음좋겄네요,0
whsk********,ETAG: 오닉스 블랙,20250501,5,,많은 기계를 써봤지만 개인적으로 제일 만족합니다. 연무량도 만족하고 타격감은 최고입니다.,0
yeop****,ETAG: 오닉스 블랙,20250511,5,,연초에서 바꿧습니다 만족스럽네요 감사합니다.,0
dear****,ETAG: 알바 블루,20250509,5,,조작법이 어려울 줄 알았는데 설명서 한번 읽어보면 될 정도네요 디자인 깔끔하고 저는 맛도 괜찮습니다 모든 궐련형 다 해보다가 차이코스로 갈아탔는데 주변 만족도가 높아서 기대됩니다ㅎㅎ,0
kimc********,ETAG: 차콜 그레이,20250511,5,,너무 좋아요 잘쓰고있습니다,0
soue****,ETAG: 차콜 그레이,20250513,5,,배송도 빠르고 매우 만족합니다,0
goos*****,ETAG: 쉬폰 화이트,20250507,5,,잘쓰고있어요.. 생각보다 흰색인데 때도 덜타네요. 배터리도 오래가구요~,0
tjdw********,ETAG: 알바 블루,20250514,5,,우와...릴에서 이걸로 갈아타기 잘한것같아요 ㅠㅠ,0
dj****,ETAG: 알바 블루,20250421,5,,가격은 비싸나 온도조절이나 부가적 기능으로 만족합니다 과거 동일회사 제품 2번 써봣는데 블레이드는 2달만에 고장이나 파손되는 경우가 많아서 고민했는데 인덕션 버전이라 습기나 파손 염려가 적어서 좋아요,0
ehda*****,ETAG: 쉬폰 화이트,20250508,5,,좋아요 디자인도 이쁘고 쓰기편해요,0
k1****,ETAG: 쉬폰 화이트,20250425,5,,권련형전자담배 한달사용 했습니다. 연무량도 변함없고 사용하기 매우 편리하네요~전담 사용자분 추천합니다.,0
hsys****,ETAG: 차콜 그레이,20250429,5,,아이코스쓰다가 바꿨는데 이유는 먼지몰라도 연조같고 오래피고 타격감이생겨요 끝에는 살짝독하단 느낌까지 들어요 비교불가네요,0
mula*****,ETAG: 오닉스 블랙,20250424,5,,하루만에 배송완료입니다. 남편이 담배를 조금씩 줄여본다고 하여 주문했어요. 아직 사용전이라 잘 모르겠지만 디자인은 일단 이쁘네요^^ 남편이 사용후 다시 후기 올릴께요~,0
kain******,ETAG: 알바 블루,20250502,5,,잘쓰고 있습니다. 색상도 이뻐요,0
hsys****,ETAG: 차콜 그레이,20250513,5,,진짜 강추 릴 아이코스 다써봤지만 비교가안되요,0
jaim*****,ETAG: 차콜 그레이,20250507,5,,너무 좋아요 지금껏 써왔던것 중에 최고 입니다,0
gong******,ETAG: 차콜 그레이,20250509,5,,담배 냄새는 취향이 아니지만 그래도 기계는 만족스럽습니다,0
oa****,ETAG: 알바 블루,20250512,5,,잘 쓰고 있습니다 연초보다 좋아요,0
shak*****,ETAG: 오닉스 블랙,20250513,5,,남편 담배 냄새 덜 나게 하려고 샀는데 만족합니다..ㅎㅎ,0
drea***,ETAG: 알바 블루,20250414,5,,"릴이후 담배를 끊었다가 잠깐씩 필 용도로 검색해 보니 후기가 좋아 구입했습니다. 생각보다는 괜찮네요. 배터리가 오랴가는게 마음이 드네요. 온도조절도 마음에 들고, 고장만 안나면 추천입니다.",0
ue****,ETAG: 오닉스 블랙,20250514,5,,몇달째 사용 중인데 잘사용하고 있습니다,0
jsh7***,ETAG: 차콜 그레이,20250512,5,,처음펴보는데 이상한데 갈수록 적응중입니다 적응해야져 ㅋㅋㅋ,0
smki*****,ETAG: 오닉스 블랙,20250509,5,,잘 사용중입니다. 연속 사용도 가능해요.,0
shar******,ETAG: 알바 블루,20250507,5,,너무 만족해요 연초를 줄이게 되요,0
kym8*****,ETAG: 오닉스 블랙,20250419,5,,저는 화이트색상으로 사용하고 있습니다 남친이 전담을 갖고싶다해서 블랙으로 재구매 했어요 모드변경이랑 시간등 변경이 가능해서 좋구요 2년 가까이 사용중인데 고장도 안나고 가성비 좋아요,0
4608****,ETAG: 알바 블루,20250506,5,,담배좀 끈어볼까해서 전담으로 넘어왔는데 제품은 괜찮은데 사람이 문제네요 아직 끈질못하고 연초랑 전담이랑 같이 피고 있네요 ㅜㅜ 언젠간 전담만피다가 끈을수 있는 날이 오거라 믿어봅니다 ㅎㅎ 제품은 좋아요,0
budk*****,ETAG: 오닉스 블랙,20250509,5,,이제는 연초 안피우고 있습니다 내구성 좋기를 바랍니다,0
sktm*****,ETAG: 쉬폰 화이트,20250511,4,,무난하게 사용하기 좋아요,0
lje4***,ETAG: 차콜 그레이,20250509,5,,맘에들고 맛도 조아요,0
oy****,ETAG: 차콜 그레이,20250424,4,,살짝 아쉬운게 있어요.. 하나 피고나서 다음꺼 필려고 끼면 될 때 있고 안될 때 있어서 3번정도 뺐다가 껴야되요....열이 남아있어서 그런 것 같은 느낌이에요,0
acek*****,ETAG: 오닉스 블랙,20250511,5,,잘 받았습니다 많이 파세요.,0
bo****,ETAG: 차콜 그레이,20250503,5,,한달 넘게 사용중인데. 나름 만족하며 사용중입니다. 굿~,0
dudg******,ETAG: 오닉스 블랙,20250313,5,,"금연을 목표로 바꿔보려고 구매했습니다. 물론. 한방에 끊어버리는것이 맞겠지만 그게 번번히실패하니 냄새라도 없애고픈심정으로 기기검색하다가 찾은 이태그 , 좋은상품평을 기반으로 믿고 구매하고 방금 첨 사용해봤는데 생각이상으로 괜찮은거같습니다 물론 연초에 비교하기엔 무리가잇지만 충분히 이걸로 만족하고 갈아탈수잇을거같네요^^",0
ykpa******,ETAG: 알바 블루,20250429,5,,타제품비교해도 좋아요 연무감 좋고 그립감도 좋아요,0
bani****,ETAG: 오닉스 블랙,20250501,5,,아이코스쓰는데 연무량이 더 많네요..잘 쓰겠습니다~,0
pq****,ETAG: 오닉스 블랙,20250426,5,,배송 빠르고 물건상태 좋습니다. 기존 사용하던 아이코스보다 만족감이 더 높습니다.,0
ca****,ETAG: 차콜 그레이,20250416,5,,리뷰대로 사용하기 편하고 깔끔하고 군더더기가 없네요 강추합니다,0
mr77***,ETAG: 알바 블루,20250507,5,,이태그 궐련형 전자담배 아주 좋아요,0
cyso*****,ETAG: 차콜 그레이,20250506,5,,"타격감 만족하고, 청소를 안해도 돼서 매우 만족합니다",0
ru75****,ETAG: 오닉스 블랙,20250417,5,,"며칠 써보고 리뷰 남겨요. 원래 액상 전자담배를 오래 피웠다 보니 다른 건 몰라도 연무량에 큰 차이를 느꼈습니다. 근데 사용하다 보니 점차 적응이 되는 것 같아요. 그립감에 관련된 리뷰도 있었는데 저는 좋았고요, 배터리도 오래가고 색감도 괜찮은 것 같습니다. 처음 사용하다 보니 온도, 시간 설정이 고민이었지만 멘솔 모드, 타바코 모드가 있어서 편한 것 같아요. 결론적으로 기기는 좋습니다. 제 생각엔 스틱을 잘 고르는 게 중요한 것 같아요.",1
guse*****,ETAG: 알바 블루,20250509,5,,그립감 좋고 작동도 잘 됩니다 ㅎㅎ,0
rymz***,ETAG: 알바 블루,20250508,5,,액상없어도되서 너무좋아요,0
dlql****,ETAG: 알바 블루,20250408,5,,스틱 꽂는 전자담배 첫사용입니다 생각보단 쩐내가 좀나긴하네요 한번잘사용해볼게요,0
para********,ETAG: 쉬폰 화이트,20250504,5,,좋아요. 감사합니다.,0
jeon*******,ETAG: 차콜 그레이,20250414,5,,타사 기기보다 좀 작고 디자인이 이쁘네요 무게감은 배터리 때문에 어쩔수 없는듯 하고 히팅시간이 있어서 좀 기다리는 시간이 있긴 하지만 사용하는데 큰 문제없네요 색상도 다양해서 한참 고민 하다 구입했습니다.,0
whdn**********,ETAG: 오닉스 블랙,20250508,5,,선물로 샀는데 매우 만족 하답니다 !!,0
eric****,ETAG: 차콜 그레이,20250507,5,,제품 박아서 써보는데 확실히 좋아요!,0
dj****,ETAG: 알바 블루,20250410,5,,옛날에 블레이드?버전 2달쓰다 망가져서 후회했는데 인덕션형이라 부러지거나 고장확률이 줄엇나봐요 몇번떨궛는데도 고장도안나고 생각보다좋아요 맛은 아직까진 쪄진 담배맛이긴합니다 확실히 다들 냄새가 안난다해서 나름좋아요,0
wook****,ETAG: 오닉스 블랙,20250429,5,,연초 생각이 안나네요 적응하니깐 넘넘 편합니다 냄새없이 담배 재도 안날리고ㅋㅋ,0
jujk****,ETAG: 차콜 그레이,20250509,5,,좋아요 가볍고 냄새안나고!,0
budk*****,ETAG: 쉬폰 화이트,20250509,5,,덕분에 연초는 완전히 끊었어요,0
neet******,ETAG: 차콜 그레이,20250428,5,,금요일에주문해서 토요일에왔어요 배송 맘에드네요,0
myme*****,ETAG: 오닉스 블랙,20250424,5,,작동 잘되고.. 역시 찐냄세는 어쩔수 없는거 같아요.한달 써보고 또 후기 남길께요,0
