작성자,제품명,리뷰작성일,별점,한달 사용기,리뷰 내용,도움 수
nave*****,베이포레소 크로스 4 미니 / 컬러: 아이스 퍼플,20241030,5,,배송이 진짜 빠르네요 하루만에 왔어요 잘 쓸게요! 색상도 너무 이쁘네요 ㅎㅎ 보조배터리도 감사합니다!,0
sook********,베이포레소 크로스 4 미니 / 컬러: 샴페인 골드,20241002,5,,"공휴일 제외 하루만에 도착, 배송 진짜 빠르네요. 지인이 추천해줘서 샀어요. 증정품도 푸짐하게 보내주셔서 감사합니다. 해외 살아서 사용해 보고 괜찮으면, 가기 전에 추가 주문 할게요.",0
geen****,베이포레소 크로스 4 미니 / 컬러: 스페이스 그레이,20241111,5,,방출안하구 케이스까자 씌워서 잘쓰고 있어요. 맛보장 기기입니다.,0
nabi******,베이포레소 크로스 4 미니 / 컬러: 스페이스 그레이,20241128,5,,배송 무지 빨리해주셔서 고맙습니다 사은품도 주시고 잘쓰겠습니다~,0
lyci*****,베이포레소 크로스 4 미니 / 컬러: 아이스 핑크,20241121,5,,사용이 편리해서 잘 쓰고있습니다.,0
qaws******,베이포레소 크로스 4 미니 / 컬러: 카모 실버,20241118,5,,항상 쓰던거라 좋습니다,0
qofu*****,베이포레소 크로스 4 미니 / 컬러: 블랙,20241118,5,,사용초기지만 아주 좋아요,0
tkfk******,베이포레소 크로스 4 미니 / 컬러: 스페이스 그레이,20241025,5,,이전에 쓰던것과는 달리 튀는 현상이나 액상이 세어 나오는 것도 없는것 같아 좋고 사이즈도 딱이고 무겁지 않아 좋아요. 재구매로 하나 더 구비해야 할까봅니다.,0
zmzm*****,베이포레소 크로스 4 미니 / 컬러: 블랙,20241112,5,,빠른배송~ 보조배터리까지 감사합니다,0
sp****,베이포레소 크로스 4 미니 / 컬러: 스페이스 그레이,20241104,5,,기존 크로스 미니보다 훨씬 장점이 많아졌네요. 특히 흡압조절 너무 좋습니다.,0
youd****,베이포레소 크로스 4 / 컬러: 블랙,20241125,5,,좋아요 전에 크로스 미니3 썼었는데 크기상관 없으면 무조건 일반모델이 좋네요,0
xody******,베이포레소 크로스 4 미니 / 컬러: 아이스 블루,20241130,5,,매장보다 저렴하게 잘샀어요 튼튼하고좋네요,0
fori****,베이포레소 크로스 4 미니 / 컬러: 블랙,20241031,5,,동료 추천으로 구매했어요 사은품도 빠른배송도 감사드립니다.,0
styl********,베이포레소 크로스 4 미니 / 컬러: 카모 실버,20241020,5,,"발라쓰다가 크로스로 넘어왔습니다. 휴대성, 맛, 코일유지 어느하나 부족함이 없고 거기에 누수도 없어서 너무좋아요.",0
styl********,베이포레소 크로스 4 미니 / 컬러: 스페이스 그레이,20241020,5,,"발라쓰다가 크로스로 넘어왔습니다. 휴대성, 맛, 코일유지 어느하나 부족함이 없고 거기에 누수도 없어서 너무좋아요.",0
1o****,베이포레소 크로스 4 / 컬러: 블랙,20241024,5,,배송도 빠르고 안전하게 와서 매우 만족합니다. 3미니 쓰다가 4 써보니 차이가 날 정도로 너무 좋네요.,0
uish*****,베이포레소 크로스 4 미니 / 컬러: 블랙,20241109,5,,누수도 거의 없고 출력도 좋고 완벽한 만족감을 주고 있습니다 ㅎㅎ,0
dhfl***,베이포레소 크로스 4 미니 / 컬러: 아이스 퍼플,20240903,5,,배송은 다음날 오전에 도착해서 일단 너무 놀랐습니다ㅜ 정말 많은 전자담배기기를 고민했는데 4번째 시리즈인만큼 믿고 베이프레소 크로스4!̆̈ !̆̈ !̆̈ !̆̈ !̆̈ !̆̈ !̆̈ 구매했습니다~ 직접 써본결과 정말 대만족입니다ㅎㅎ̌̈ 릴하이브리드3.0 사용하다가 베이프레소 크로스4로 넘어왔는데 후회하지 않습니다 베이프레소 짱💙💙💙💙💙 색상도 너무 마음에 들어 다음 모델도 추후 구매 예정입니다. 좋은 제품 만들어주셔서 감사합니다^^,1
dlsg*******,베이포레소 크로스 4 미니 / 컬러: 카모 실버,20241107,5,,배송 진짜 빠르구 디자인도 넘 맘에 들어옹!,1
kkdj****,베이포레소 크로스 4 / 컬러: 선셋 네온,20241203,5,,현재까지 고장없이 잘 사용하고있습니다,0
fkdf******,베이포레소 크로스 4 미니 / 컬러: 샴페인 골드,20241128,4,,사용하던제품이라 믿고 쓰려구용 색상 이쁘네요,0
1103****,베이포레소 크로스 4 미니 / 컬러: 스페이스 그레이,20241116,5,,남편이 잘쓰고있습니다 ㅎㅎ,0
tmdw*****,베이포레소 크로스 4 미니 / 컬러: 스페이스 그레이,20250103,5,,👍👍👍👍👍,0
y0****,베이포레소 크로스 4 미니 / 컬러: 블랙,20241110,5,,크로스3에비해 많이 개선되어 편하게 사용중,0
qhru****,베이포레소 크로스 4 미니 / 컬러: 블랙,20241125,5,,완전 좋습니다. 오토 흡입 처음인데 신세계네요.,0
tjrq******,베이포레소 크로스 4 미니 / 컬러: 블랙,20241122,5,,진짜 엄청나게 만족합니다. 너무 좋아용+_+,0
no****,베이포레소 크로스 4 미니 / 컬러: 카모 레드,20241104,5,,배송 빠르고 역시 베이포레소 기기싸이즈 미니멀하고 이뻐요,0
seou****,베이포레소 크로스 4 미니 / 컬러: 스페이스 그레이,20241201,5,,항상 쓰는 제품입니다,0
skun****,베이프레소 크로스 4 나노 / 컬러: 워드 팝 블루,20241031,5,,입문자라 잘 몰라서 질문해도 친절하게 응대해주시고 배송 정말 빠릅니다. 많이파세요,0
akgk****,베이포레소 크로스 4 미니 / 컬러: 스페이스 그레이,20241202,5,,배성빨라요나머굳굳굳,0
enbi****,베이포레소 크로스 4 미니 / 컬러: 스페이스 그레이,20241121,5,,지인 선물용으로 4개째 구매. 아주 좋아요,0
qkra********,베이포레소 크로스 4 / 컬러: 블랙,20241104,5,,잘 사용하고 있습니다 👍👍 휴대하기도 편하고 맛 표현도 좋아요~~~,0
tlsd******,베이포레소 크로스 4 미니 / 컬러: 아이스 퍼플,20241005,5,,여태 산건 액상이 새거나 자꾸같이 마셧는데 그런거하나없고 가끔 찔끔새긴한데 이정도면 그래도 다행이라고생각합니다!색상도 이쁘고 전담때문에 담배 많이 줄여가고있습니다ㅎ,1
j_ti***,베이포레소 크로스 4 미니 / 컬러: 블랙,20241107,5,,제품배송 모두 만족합니다,0
lmsl****,베이포레소 크로스 4 미니 / 컬러: 아이스 블루,20241127,5,,이번에 새로 샀는데 너무 맘에 드네요,0
gjck******,베이포레소 크로스 4 미니 / 컬러: 스페이스 그레이,20240731,5,,"이번에 두번째 구매입니다 흡입감 조절이 좋아서 예전에 흡입감이 빡세서 버리려고했던 미니3의 0.8옴짜리 코일도 훅훅 잘빨아지니 버리지않고 쓰게되네요 공팟 다 쓰고있는중ㅋㅋ 저는 이번 리뷰에 공팟 누수에관해 요령 몇개를 제 스스로 파악해본걸로 말씀드려보려합니다. 참고로 이 방법들로 누수생기면 거의 다 버리는것 없이 썼습니다 (가끔 완전불량빼구요ㅎㅎ) 보통 액상주입하실때 성질대로 쭈욱~~~짜서 1~2초내에 2ml나3ml 채우시는분들 계시는데 이 경우 많은분들이 누수 경험 해보셨을겁니다 (액상은 살살 넣자구요ㅋㅋㅋ) 그 이유가 코일엔 공기가 주입되거나 압력이 차지않게 공기구멍 여러개가 존재하는데 그 곳에 기포같은것처럼 액상이 닿게되면 막힘현상 비슷한게 생겨요 그 기포가 외부에서 들어와야하는 공기를 차단시키고 액상은 반진공상태에서 밖으로 빠져나가려는 현상이 생기는걸로 예상이됩니다 그리고 코일과 바닥의 구멍은 연결되어있어요 그래서 제가 하는방법은 1번사진. 코일구멍에 액상층이 흡수가안된것처럼 물이 차 있는것처럼 보일경우 입으로 아주살짝 슈~하고불어주면 그 공기방울이 터져 코일에 붙습니다 세게 불면 밑의 공기구멍으로 누수됩니다 그리고 코일구멍 옆 공기구멍(액상주입구아닙니다)이 액상으로 막혀있지않나 확인해주시고 그곳이 막혀있으면 휴지같은걸로 닦아주셔서 막힌걸 뚫어줍니다 2번째사진. 공팟 밑부분 구멍이 두개 있쥬? 저는 보통 먼저 저부분에 누수된걸 닦은다음에 입에 대서 살짝 불어봅니다 부글부글 소리나면 백퍼 누수 되는거에요 그렇게 뚫어주면 보통 해결되는데 그래도 훈지로 슥슥 훑었는데 나온다면 휴지로 끝부분을 똘똘비벼서 뾰족하게 만든다음에 그걸 넣어서 샌 액상을 흡수시켜보고 더이상 액상이 많이 뭍어나오는거 같지 않다 하실때 다시 입으로 불어보시면 부글소리가 없어졌을때 코일통 바닥을 탁탁 휴지위에서 내리때립니다 그때 액상이 새어나오지않으면 누수는 해결될거에요 이게 말로 풀어하려니 엄청긴데 막상 해보시면 몇분 안걸립니다ㅋㅋㅋ 그리고 아까 강조했다시피 입으로 불으실땐 아주 살짝~살~살~불어주세요 안그럼 계속 액상만 줄줄줄 여기저기 튀어서 망가집니다 (네.,제가 그랬어요..) 그리고 보통 액상은 니코틴 원액이 들어있는거니 입술에 직접닿으면 나중에 입술이 엄청 따가워지거나 헐게되는데 그걸 방지하시려면 마른휴지 많이 필요합니다ㅋㅋ 두루마리 휴지 한개 딱 가져다놓고하시길 권고드립니다",3
baby******,베이포레소 크로스 4 / 컬러: 파스텔 팔레트,20241101,5,,너무 이쁘고 좋아요 잘쓰고있어요,0
hwan*****,베이포레소 크로스 4 미니 / 컬러: 블랙,20241104,5,,배송 빠르고 너무 좋아요!,0
jayk****,베이포레소 크로스 4 미니 / 컬러: 카모 실버,20241101,5,,가볍고 얇고 팟은 맛표현도 좋고 정말 만족합니다,0
habs*****,베이포레소 크로스 4 미니 / 컬러: 카모 레드,20241101,5,,미니3 너무잘써서 미니4도 믿고 구매해요,0
dhar******,베이포레소 크로스 4 미니 / 컬러: 스페이스 그레이,20241101,5,,누수없고 좋아요만족합니다,0
ka****,베이포레소 크로스 4 미니 / 컬러: 블랙,20241011,5,,배송도 빠르고 블랙으로 선택했는데 재고가 없어서 그레이로 바꿨는데 색깔이 너무 좋네요. 크기가 클거라고 생각했는데 생각보다 작아서 좋습니다.,0
wnsr****,베이포레소 크로스 4 미니 / 컬러: 스페이스 그레이,20241104,5,,미쳐버린 전담 기계. 성능과 휴대성이 GOAT. 색상마저 섹시.,0
wnst*******,베이포레소 크로스 4 미니 / 컬러: 블랙,20241106,5,,역시 가볍고 좋아요,0
leec*****,베이포레소 크로스 4 미니 / 컬러: 아이스 퍼플,20241101,5,,아는 지인분이 가지고 싶다고 해서 하나더 구매했습니다 ㅎ,0
jhjj****,베이포레소 크로스 4 미니 / 컬러: 블랙,20241011,5,,빠른 배송 감사합니다~ 바로 사용하는데 좋은거 같습니다!! 배터리 충전기 서비스 같이 보내주셔서 좋습니다!! 다음에도 재구 하겠습니다!!,0
hamh*****,베이포레소 크로스 4 / 컬러: 실버,20241026,5,,생각보다 큰데 배송도 빠르고 좋아요,0
leec*****,베이포레소 크로스 4 미니 / 컬러: 아이스 그린,20241029,5,,모든면에서 좋았는데 기본기기에 들어있는 코일 앞부분이 안열리네요...,0
drea*****,베이포레소 크로스 4 미니 / 컬러: 블랙,20241101,5,,항상 애용하는 제품 입니다,0
no****,베이포레소 크로스 4 / 컬러: 블랙,20241030,5,,넘넘 맘에 들어서 몇개 더 샀어요!,0
jal1***,베이포레소 크로스 4 미니 / 컬러: 블랙,20241111,5,,좋아요좋아요좋아요좋아요좋아요좋아요좋아요좋아요좋아요좋아요좋아요좋아요좋아요좋아요좋아요,0
no****,베이포레소 크로스 4 / 컬러: 그린,20241030,5,,빠른 배송 감사합니다 :),0
stev*****,베이포레소 크로스 4 미니 / 컬러: 블랙,20241121,5,,잘쓰고 있습니다 크기도 딱 적당,0
god6***,베이포레소 크로스 4 미니 / 컬러: 블랙,20241120,5,,가볍고 편해서 좋아요,0
herb****,베이포레소 크로스 4 미니 / 컬러: 블랙,20241119,5,,남편 사줬습니다. 잘 사용하고 있습니다,0
kore******,베이포레소 크로스 4 미니 / 컬러: 블랙,20241023,5,,원래 좋습니다. 기존쓰던거에서ㅠ하나더삿어요,0
cj****,베이포레소 크로스 4 미니 / 컬러: 스페이스 그레이,20241027,5,,배송도 빠르고 잘 사용하고 있어요,0
mi****,베이포레소 크로스 4 / 컬러: 블러디 메리,20241024,5,,만족도 최상의 팟디바이스입니다 디저트를 좋아하는데 딱이네요,0
1224****,베이포레소 크로스 4 미니 / 컬러: 카모 레드,20241117,5,,배송빠르고 좋아요.,0
geen****,베이포레소 크로스 4 미니 / 컬러: 스페이스 그레이,20241007,5,,기기 2개 쓰다가 추가했는데 맛표현이 제일 맘에 드네요. 액상충전은 천천히 하세요~,0
mode******,베이포레소 크로스 4 미니 / 컬러: 블랙,20241217,5,,아주~~~~~~~~~~,0
yhsa****,베이포레소 크로스 4 미니 / 컬러: 블랙,20241013,5,,배송 빠르고 제품 좋습니다. 기존 크로스미니3 쓰고있었는데 3년되니 배터리도 소모가 빠르고 부족한거같아 미니4 구매하였는데 쓰던브랜드라 카트리지도 호환되고 잘구매한거 같습니다. 특히 흡압조절이 되어 미니3보다 맛표현및타격감이 매우 좋네요. 감사합니다. 마니 파세요.,0
mush*******,베이포레소 크로스 4 미니 / 컬러: 아이스 퍼플,20241012,5,,예쁘고 가볍고 다 좋아요 흡압 조절도 가능해서 더 마음에 듭니다,0
sol9****,베이포레소 크로스 4 미니 / 컬러: 아이스 퍼플,20241118,4,,진짜 괜찮은 기기같습니다,0
tdkf*******,베이포레소 크로스 4 미니 / 컬러: 카모 실버,20241009,5,,해외여행으로 급히 가벼운게 필요했는데 만족스럽습니다. 친절한 응대 감사합니다:),0
q000*****,베이포레소 크로스 4 미니 / 컬러: 블랙,20241014,5,,베소포레소는 예전부터 잘 사용해왓고 새로운버젘 나와서 구매햇습니다. 민복합니다.,0
rlgu******,베이포레소 크로스 4 미니 / 컬러: 스페이스 그레이,20241104,5,,정말좋아요 부드럽고 깔금한디자인 맘에드네요,0
munm***,베이포레소 크로스 4 미니 / 컬러: 카모 실버,20241015,5,,가끔 누수 터지는데 그래도 구조가 좋아서 기기내부로 유입되진 않을거같아요 이쁩니다,0
myka***,베이포레소 크로스 4 미니 / 컬러: 아이스 퍼플,20241024,5,,빠른 배송으로 잘 받았습니다,0
burt****,베이포레소 크로스 4 미니 / 컬러: 카모 실버,20241013,5,,간편하게 소지하고 편하고 좋네요 에어홀 다막고 6이 쫀쫀하고 4는 널널하고 8은 너무 쫀쫀해서... 6이 적당히 쫀쫀하고 좋네요,0
lyci*****,베이포레소 크로스 4 미니 / 컬러: 아이스 핑크,20241022,5,,배송 빠르고 믿고 잘쓰고있어요,1
za****,베이포레소 크로스 4 미니 / 컬러: 블랙,20241011,5,,아직 사용은 안해봤지만 좋다고해서 믿고 있습니다. 잘 쓰겠습니다.,0
etur*****,베이포레소 크로스 4 / 컬러: 실버,20241018,5,,"그립감과 풍부한 연기, 세련된 디자인 다 좋습니다",0
xody******,베이포레소 크로스 4 미니 / 컬러: 아이스 블루,20241025,5,,배송도 하루만에왔어요 챙겨주신 보조배터리 감사합니다 잘쓸게요~,0
whda******,베이포레소 크로스 4 미니 / 컬러: 블랙,20241114,5,,기기가 좋아유 진짜 추천,0
gb****,베이포레소 크로스 4 미니 / 컬러: 스페이스 그레이,20241021,5,,에어홀 기능이 생겨서 좋아요.,0
wass******,베이포레소 크로스 4 미니 / 컬러: 카모 실버,20241008,5,,기기추가구입했어요 추천합니다 배송도 빠르고 기기이쁘고 좋아요,0
pt96*****,베이포레소 크로스 4 미니 / 컬러: 스페이스 그레이,20241109,5,,배송상품매우만족합니다,0
x9****,베이포레소 크로스 4 미니 / 컬러: 스페이스 그레이,20241017,5,,배송이 빨라서 좋았어요,0
swan****,베이포레소 크로스 4 미니 / 컬러: 스페이스 그레이,20241101,5,,"배송이 정말 빠르고, 보조배터리도 주셔서 잘 받았습니다.",0
geso****,베이포레소 크로스 4 미니 / 컬러: 블랙,20241108,5,,물건 좋아요 물건 좋아요,0
dora****,베이포레소 크로스 4 / 컬러: 블랙,20241023,5,,한달동안 사용하고있는데 아주 대만족임니다 ㅎ 궐련형 전자담배보다 훨씬 좋은듯 냄새도 안나구용,0
db****,베이프레소 크로스 4 나노 / 컬러: 워드 팝 블루,20241018,5,,너무 작고 편안하네요 강추합니다!!,0
cheo********,베이포레소 크로스 4 미니 / 컬러: 스페이스 그레이,20241019,5,,미니인데 생각보다 커요,0
dnrh******,베이포레소 크로스 4 미니 / 컬러: 스페이스 그레이,20241127,5,,좋아요좋아요좋아요!!!,0
dnrh******,베이포레소 크로스 4 미니 / 컬러: 아이스 핑크,20241127,5,,좋아요좋아요좋아요!!!!,0
skyr******,베이포레소 크로스 4 미니 / 컬러: 스페이스 그레이,20241020,4,,사용이 편하고 좋습니다 라고~,0
1103****,베이포레소 크로스 4 미니 / 컬러: 스페이스 그레이,20241017,5,,굿 회사에서피기좋아요,0
sol9****,베이포레소 크로스 4 미니 / 컬러: 아이스 퍼플,20241019,4,,가볍고 편하네요 좀 더 써볼게요,0
uish*****,베이포레소 크로스 4 미니 / 컬러: 블랙,20240929,5,,주문하고 다음 날에 바로 잘 받았습니다!! 사은품도 마침 필요하던 거라 너무 만족스럽네요 감사합니다 : ),0
thor****,베이포레소 크로스 4 미니 / 컬러: 카모 실버,20240925,5,,기존에쓰던게 배터리오래못써서 신상나왔길래 구매했어요 기존꺼보다 살짝 길고 무겁네요 디자인은 이쁘네요 맛표현 만족해요,0
dltj*****,베이포레소 크로스 4 미니 / 컬러: 블랙,20241014,5,,일단 밧데리 용량이 확실히 커져서 좋네요,0
if_h*****,베이포레소 크로스 4 미니 / 컬러: 블랙,20241015,4,,배송빠르고 괜찮아요,0
taey********,베이포레소 크로스 4 미니 / 컬러: 블랙,20241030,5,,하루만에 배송! 기기는 전에 썼던거라 매우 만족!👍👍👍,0
ttl8*****,베이포레소 크로스 4 미니 / 컬러: 블랙,20241103,5,,흡입력 조절 완전 굿입니다요!!,0
rjqn*****,베이포레소 크로스 4 미니 / 컬러: 스페이스 그레이,20241028,5,,좋아요 한손에 딱 들어오고,0
y0****,베이포레소 크로스 4 미니 / 컬러: 블랙,20241011,5,,기존에 사용하던 크미니3을 강에 빠뜨려서 새로 샀는데 만족합니다,0
kjkh*****,베이포레소 크로스 4 미니 / 컬러: 스페이스 그레이,20241007,5,,배송도 빠르고 제품도 마음에 듭니다 감사합니다,0
cheo******,베이포레소 크로스 4 / 컬러: 블랙,20241018,5,,깔끔하고 좋네요!!,0
asd7***,베이포레소 크로스 4 미니 / 컬러: 블랙,20241103,5,,빠른 배송 좋습니다!,0
dawn*******,베이포레소 크로스 4 미니 / 컬러: 카모 레드,20241102,5,,가볍고 역류도 없고 좋네요,0
x9****,베이포레소 크로스 4 미니 / 컬러: 블랙,20241005,5,,😀 👍 좋아요 배송이 빨라서 더 좋아,0
heum****,베이포레소 크로스 4 미니 / 컬러: 스페이스 그레이,20241008,5,,작아서 휴대성이 너무 좋네요,0
mars*****,베이포레소 크로스 4 미니 / 컬러: 카모 실버,20241026,5,,발라x안 젤x보다 좋슴니다.무저건 구매,0
limy****,베이포레소 크로스 4 미니 / 컬러: 스페이스 그레이,20241005,4,,괜찮아요. 나쁘지않아요.,0
haha******,베이포레소 크로스 4 미니 / 컬러: 아이스 퍼플,20241024,5,,"연초담배처럼 냉새도 없고, 휴대하기도 편해서 좋아요",0
cy****,베이포레소 크로스 4 미니 / 컬러: 카모 실버,20241018,5,,첫 전자담배로 지인들한테 추천받아서 사게되었는데 너무 마음에듭니다,0
ming*****,베이포레소 크로스 4 미니 / 컬러: 블랙,20240927,3,,친구들 거 필 때는 괜찮아서 산 건데 저는 새 제품인데 빨 때 툭툭툭 거리면서 잘 안 빨리고 세게 빨면 가슴통증이 되게 심하네요,0
gy****,베이포레소 크로스 4 미니 / 컬러: 스페이스 그레이,20240717,5,,하루만에 배송되다니 ㅎㅎ 오자마자 박스 뜯고 개시했어요 미니사이즈라 손바닥에 올려봤는데 딱좋아요 선물로주신 밧데리와 딱입니다 ㅋㅋ 흡입구 열고 액상 넣으니 흐를 염려없고 간편합니다 흡입구열때 위로 올리지마시고 꺽듯이 열면쉬워요 한참을 위로 열려고 애썼다는 ㅠㅠ 여전에 하카사서 흡입력이 약해 걱정했는데 전혀 쓸데없는것이었네요 ㅎㅎ 액상넣고 잠시 기다리다 피워봤는데 흡입력 무엇입니까? 작다고 무시할게 아니네요 흡입력과 분무량 어디에 뒤지지않아요 약할까봐 걱정하시는분들 그냥 믿고 사보세요 굿입니다! 공기조절기는 있지만 열지않아도 충분하더라고요 은은한 색감마저 좋아요 톡톡으로 많은 질문드렸는데 친절히 답변주신덕에 실패없는 구입이었어요 감사합니다 ^^,0
en****,베이포레소 크로스 4 미니 / 컬러: 스페이스 그레이,20240920,5,,기존 크로스3 미니 사용 중에 고장이 나서 새로 구입했어요. 빠른 배송과 더 좋아진 품질에 만족합니다! 서비스도 짱짱!,0
qogu********,베이포레소 크로스 4 미니 / 컬러: 샴페인 골드,20240928,5,,색상이 너무 이뻐요 보빠사은품감사합니당,0
kkg3***,베이포레소 크로스 4 미니 / 컬러: 블랙,20241023,5,,디자인 성능 좋아요 만족합니다,0
khan****,베이포레소 크로스 4 미니 / 컬러: 블랙,20240930,5,,잘 받았습니다. ^^ 호흡 조절이 신기하네요,0
dung***,베이포레소 크로스 4 미니 / 컬러: 샴페인 골드,20240927,5,,배송도 너무 빠르고 보조배터리도 서비스로 주셨습니다 감사합니다,0
kmw8***,베이포레소 크로스 4 미니 / 컬러: 스페이스 그레이,20240929,5,,기존 기기가 고장나서 구매했는데 저렴하고 작고 가벼워서 좋아요!,0
jyjl*******,베이포레소 크로스 4 미니 / 컬러: 카모 실버,20240920,5,,일단 디자인 졸라 맘에 들어요 카모 너무 이쁨 ..🎀!! 거기다가 보조배터리까지 주네요?? 아주 좋아용~,0
ykdk****,베이포레소 크로스 4 미니 / 컬러: 블랙,20241021,5,,배송 빠르게 왔습니다 감사합니다!,0
hyun*******,베이포레소 크로스 4 미니 / 컬러: 아이스 블루,20241003,5,,휴대하기엔 진째 최고에요 ㅎㅎ 기존 액상용량보다 커져서 하루죙일 사용할수있게됬네요 ㅎㅎ 만족합니다 !,0
cj****,베이포레소 크로스 4 미니 / 컬러: 스페이스 그레이,20241020,5,,조라요 배송 빠르고 깔끔하네요,0
viol******,베이프레소 크로스 4 나노 / 컬러: 티타늄 실버,20240912,5,,크로스3나노 대비 무게는 체감이 될정도로 좀 늘긴 했지만 다양한 기능이 늘은 부분에 있어 만족하네요 좋아요,0
uare****,베이포레소 크로스 4 미니 / 컬러: 아이스 핑크,20241011,5,,크로스 미니3 쓰다가 1년정도 사용했고 예비로 하나 가지고있고 싶어 주문했는데 배송이 엄청빠르네요,0
dnrh******,베이포레소 크로스 4 미니 / 컬러: 스페이스 그레이,20241023,5,,소개 받아 샀는데 좋네요,0
dnrh******,베이포레소 크로스 4 미니 / 컬러: 아이스 핑크,20241023,5,,소개 받아 샀는데 좋네요,0
tkse*****,베이포레소 크로스 4 미니 / 컬러: 카모 실버,20241010,5,,한달동안 사용결과 휴대성도 편하고 단맛 올려주는게 값어치합니다!,0
youn******,베이포레소 크로스 4 미니 / 컬러: 스페이스 그레이,20240927,5,,믿음의 선장님! 사은품도 감사드립니다!,0
jal1***,베이포레소 크로스 4 미니 / 컬러: 블랙,20241010,5,,좋아요좋아요좋아요좋아요좋아요좋아요좋아요좋아요좋아요좋아요좋아요좋아요좋아요좋아요,0
smar*******,베이포레소 크로스 4 미니 / 컬러: 카모 실버,20240926,5,,넘 빠르고 만족합니다 감사합니다,0
en****,베이포레소 크로스 4 미니 / 컬러: 스페이스 그레이,20241022,5,,배터리 넉넉해서 좋네요!,0
hyej******,베이포레소 크로스 4 미니 / 컬러: 아이스 핑크,20240924,5,,좋아요좋아요!!!!!!색도 이뻐요,0
cjw1***,베이포레소 크로스 4 미니 / 컬러: 블랙,20240929,5,,감사히 잘받았습니다 보내주신 서비스 제품도 너무 좋고요 사업 번창 하세요,0
1224****,베이포레소 크로스 4 미니 / 컬러: 카모 레드,20241017,5,,배송빠르고 제품도 좋네요,0
pkgu***,베이포레소 크로스 4 미니 / 컬러: 블랙,20241004,5,,누수 없이 간단히 쓰기 넘 좋아요~ 신제품이 더 나옴 좋겠는데 다 비슷비슷하네요~,0
fuhe*****,베이포레소 크로스 4 미니 / 컬러: 블랙,20241010,5,,베이포레소 크로스 미니 시리즈만 3번째 사용 다음번도 같은 시리즈 계속 사용예정ㅎㅎ,0
mode******,베이포레소 크로스 4 미니 / 컬러: 블랙,20241111,5,,아주~~~~~~~~~~~~~~~,0
lyci*****,베이포레소 크로스 4 미니 / 컬러: 샴페인 골드,20240924,5,,항상 믿고 잘쓰고있습니다,0
